<?xml version="1.0" encoding="UTF-8"?>
<dataBase xmlns:xsi="http://www.w3.org/2001/XMLSchema-instance" xsi:noNamespaceSchemaLocation="user.xsd">
  <user>
    <usrName>Damian</usrName>
    <email>asdf1234damian@gmail.com</email>
    <pass>asdf1234</pass>
    <uType>Admin</uType>
  </user>

  <user>
    <usrName>Ruben</usrName>
    <email>ruben@gmail.com</email>
    <pass>asdf1234</pass>
    <uType>Admin</uType>
  </user>

  <user>
    <usrName>Ra√∫l</usrName>
    <email>raul@gmail.com</email>
    <pass>asdf1234</pass>
    <uType>Admin</uType>
    <grupo>2CM8</grupo>
  </user>

  <user>
    <usrName>Vilchis</usrName>
    <email>mafervm@gmail.com</email>
    <pass>asdf1234</pass>
    <uType>Professor</uType>
  </user>

</dataBase>
